{
 "schema": "schema/model.schema.json",
 "source": "https://argolink.io/api/catalog/v1/models?page_size=100",
 "fetched": "2026-10-07",
 "catalog_revision": "0315cdd070b19ded",
 "count": 45,
 "models": [
  {
   "id": "gpt-5.4",
   "name": "GPT-5.4",
   "provider": "openai",
   "category": "chat",
   "recommended_endpoint": "/v1/responses",
   "endpoints": [
    "/v1/chat/completions",
    "/v1/responses"
   ],
   "model_page": "https://argolink.io/en/models/gpt-5.4",
   "context_tokens": 1050000,
   "max_input_tokens": null,
   "max_output_tokens": 128000,
   "reads_images": true,
   "reasoning_efforts": [
    "low",
    "medium",
    "high",
    "xhigh"
   ],
   "default_effort": "none",
   "image": null,
   "video": null,
   "price": {
    "currency": "USD",
    "unit": "per_1m_tokens",
    "input": 0.75,
    "output": 4.5,
    "cached_input": 0.075
   },
   "list_price": {
    "currency": "USD",
    "unit": "per_1m_tokens",
    "input": 2.5,
    "output": 15,
    "cached_input": 0.25
   },
   "discount_vs_list": 0.7,
   "billing_rules": [
    {
     "rule": "reasoning_tokens_billed_as_output"
    },
    {
     "rule": "long_context",
     "prompt_tokens_over": 272000,
     "input_multiplier": 2,
     "output_multiplier": 1.5
    },
    {
     "rule": "fast_mode",
     "request_field": "service_tier: priority",
     "multiplier": 2
    }
   ]
  },
  {
   "id": "gpt-5.4-mini",
   "name": "GPT-5.4 mini",
   "provider": "openai",
   "category": "chat",
   "recommended_endpoint": "/v1/responses",
   "endpoints": [
    "/v1/chat/completions",
    "/v1/responses"
   ],
   "model_page": "https://argolink.io/en/models/gpt-5.4-mini",
   "context_tokens": 400000,
   "max_input_tokens": 272000,
   "max_output_tokens": 128000,
   "reads_images": true,
   "reasoning_efforts": [
    "low",
    "medium",
    "high",
    "xhigh"
   ],
   "default_effort": "none",
   "image": null,
   "video": null,
   "price": {
    "currency": "USD",
    "unit": "per_1m_tokens",
    "input": 0.225,
    "output": 1.35,
    "cached_input": 0.0225
   },
   "list_price": {
    "currency": "USD",
    "unit": "per_1m_tokens",
    "input": 0.75,
    "output": 4.5,
    "cached_input": 0.075
   },
   "discount_vs_list": 0.7,
   "billing_rules": [
    {
     "rule": "reasoning_tokens_billed_as_output"
    },
    {
     "rule": "fast_mode",
     "request_field": "service_tier: priority",
     "multiplier": 2
    }
   ]
  },
  {
   "id": "gpt-5.5",
   "name": "GPT-5.5",
   "provider": "openai",
   "category": "chat",
   "recommended_endpoint": "/v1/responses",
   "endpoints": [
    "/v1/chat/completions",
    "/v1/responses"
   ],
   "model_page": "https://argolink.io/en/models/gpt-5.5",
   "context_tokens": 1050000,
   "max_input_tokens": null,
   "max_output_tokens": 128000,
   "reads_images": true,
   "reasoning_efforts": [
    "low",
    "medium",
    "high",
    "xhigh"
   ],
   "default_effort": "medium",
   "image": null,
   "video": null,
   "price": {
    "currency": "USD",
    "unit": "per_1m_tokens",
    "input": 1.5,
    "output": 9,
    "cached_input": 0.15
   },
   "list_price": {
    "currency": "USD",
    "unit": "per_1m_tokens",
    "input": 5,
    "output": 30,
    "cached_input": 0.5
   },
   "discount_vs_list": 0.7,
   "billing_rules": [
    {
     "rule": "reasoning_tokens_billed_as_output"
    },
    {
     "rule": "long_context",
     "prompt_tokens_over": 272000,
     "input_multiplier": 2,
     "output_multiplier": 1.5
    },
    {
     "rule": "fast_mode",
     "request_field": "service_tier: priority",
     "multiplier": 2.5
    }
   ]
  },
  {
   "id": "gpt-5.6-luna",
   "name": "GPT-5.6 Luna",
   "provider": "openai",
   "category": "chat",
   "recommended_endpoint": "/v1/responses",
   "endpoints": [
    "/v1/chat/completions",
    "/v1/responses"
   ],
   "model_page": "https://argolink.io/en/models/gpt-5.6-luna",
   "context_tokens": 1050000,
   "max_input_tokens": 922000,
   "max_output_tokens": 128000,
   "reads_images": true,
   "reasoning_efforts": [
    "low",
    "medium",
    "high",
    "xhigh",
    "max"
   ],
   "default_effort": "medium",
   "image": null,
   "video": null,
   "price": {
    "currency": "USD",
    "unit": "per_1m_tokens",
    "input": 0.06,
    "output": 0.36,
    "cached_input": 0.006,
    "cache_write": 0.075
   },
   "list_price": {
    "currency": "USD",
    "unit": "per_1m_tokens",
    "input": 0.2,
    "output": 1.2,
    "cached_input": 0.02,
    "cache_write": 0.25
   },
   "discount_vs_list": 0.7,
   "billing_rules": [
    {
     "rule": "reasoning_tokens_billed_as_output"
    },
    {
     "rule": "long_context",
     "prompt_tokens_over": 272000,
     "input_multiplier": 2,
     "output_multiplier": 1.5
    },
    {
     "rule": "fast_mode",
     "request_field": "service_tier: priority",
     "multiplier": 2
    }
   ]
  },
  {
   "id": "gpt-5.6-sol",
   "name": "GPT-5.6 Sol",
   "provider": "openai",
   "category": "chat",
   "recommended_endpoint": "/v1/responses",
   "endpoints": [
    "/v1/chat/completions",
    "/v1/responses"
   ],
   "model_page": "https://argolink.io/en/models/gpt-5.6-sol",
   "context_tokens": 1050000,
   "max_input_tokens": 922000,
   "max_output_tokens": 128000,
   "reads_images": true,
   "reasoning_efforts": [
    "low",
    "medium",
    "high",
    "xhigh",
    "max"
   ],
   "default_effort": "medium",
   "image": null,
   "video": null,
   "price": {
    "currency": "USD",
    "unit": "per_1m_tokens",
    "input": 1.5,
    "output": 9,
    "cached_input": 0.15,
    "cache_write": 1.875
   },
   "list_price": {
    "currency": "USD",
    "unit": "per_1m_tokens",
    "input": 5,
    "output": 30,
    "cached_input": 0.5,
    "cache_write": 6.25
   },
   "discount_vs_list": 0.7,
   "billing_rules": [
    {
     "rule": "reasoning_tokens_billed_as_output"
    },
    {
     "rule": "long_context",
     "prompt_tokens_over": 272000,
     "input_multiplier": 2,
     "output_multiplier": 1.5
    },
    {
     "rule": "fast_mode",
     "request_field": "service_tier: priority",
     "multiplier": 2
    }
   ]
  },
  {
   "id": "gpt-5.6-terra",
   "name": "GPT-5.6 Terra",
   "provider": "openai",
   "category": "chat",
   "recommended_endpoint": "/v1/responses",
   "endpoints": [
    "/v1/chat/completions",
    "/v1/responses"
   ],
   "model_page": "https://argolink.io/en/models/gpt-5.6-terra",
   "context_tokens": 1050000,
   "max_input_tokens": 922000,
   "max_output_tokens": 128000,
   "reads_images": true,
   "reasoning_efforts": [
    "low",
    "medium",
    "high",
    "xhigh",
    "max"
   ],
   "default_effort": "medium",
   "image": null,
   "video": null,
   "price": {
    "currency": "USD",
    "unit": "per_1m_tokens",
    "input": 0.6,
    "output": 3.6,
    "cached_input": 0.06,
    "cache_write": 0.75
   },
   "list_price": {
    "currency": "USD",
    "unit": "per_1m_tokens",
    "input": 2,
    "output": 12,
    "cached_input": 0.2,
    "cache_write": 2.5
   },
   "discount_vs_list": 0.7,
   "billing_rules": [
    {
     "rule": "reasoning_tokens_billed_as_output"
    },
    {
     "rule": "long_context",
     "prompt_tokens_over": 272000,
     "input_multiplier": 2,
     "output_multiplier": 1.5
    },
    {
     "rule": "fast_mode",
     "request_field": "service_tier: priority",
     "multiplier": 2
    }
   ]
  },
  {
   "id": "gpt-6-astra",
   "name": "GPT-6 Astra",
   "provider": "openai",
   "category": "chat",
   "recommended_endpoint": "/v1/responses",
   "endpoints": [
    "/v1/chat/completions",
    "/v1/responses"
   ],
   "model_page": "https://argolink.io/en/models/gpt-6-astra",
   "context_tokens": 1050000,
   "max_input_tokens": 922000,
   "max_output_tokens": 128000,
   "reads_images": true,
   "reasoning_efforts": [
    "low",
    "medium",
    "high",
    "xhigh",
    "max"
   ],
   "default_effort": null,
   "image": null,
   "video": null,
   "price": {
    "currency": "USD",
    "unit": "per_1m_tokens",
    "input": 3,
    "output": 15,
    "cached_input": 0.3,
    "cache_write": 3.75
   },
   "list_price": {
    "currency": "USD",
    "unit": "per_1m_tokens",
    "input": 10,
    "output": 50,
    "cached_input": 1,
    "cache_write": 12.5
   },
   "discount_vs_list": 0.7,
   "billing_rules": [
    {
     "rule": "reasoning_tokens_billed_as_output"
    },
    {
     "rule": "long_context",
     "prompt_tokens_over": 272000,
     "input_multiplier": 2,
     "output_multiplier": 1.5
    },
    {
     "rule": "fast_mode",
     "request_field": "service_tier: priority",
     "multiplier": 2
    }
   ]
  },
  {
   "id": "gpt-6-sol",
   "name": "GPT-6 Sol",
   "provider": "openai",
   "category": "chat",
   "recommended_endpoint": "/v1/responses",
   "endpoints": [
    "/v1/chat/completions",
    "/v1/responses"
   ],
   "model_page": "https://argolink.io/en/models/gpt-6-sol",
   "context_tokens": 1050000,
   "max_input_tokens": 922000,
   "max_output_tokens": 128000,
   "reads_images": true,
   "reasoning_efforts": [
    "low",
    "medium",
    "high",
    "xhigh",
    "max"
   ],
   "default_effort": "medium",
   "image": null,
   "video": null,
   "price": {
    "currency": "USD",
    "unit": "per_1m_tokens",
    "input": 0.6,
    "output": 3,
    "cached_input": 0.06,
    "cache_write": 0.75
   },
   "list_price": {
    "currency": "USD",
    "unit": "per_1m_tokens",
    "input": 2,
    "output": 10,
    "cached_input": 0.2,
    "cache_write": 2.5
   },
   "discount_vs_list": 0.7,
   "billing_rules": [
    {
     "rule": "reasoning_tokens_billed_as_output"
    },
    {
     "rule": "long_context",
     "prompt_tokens_over": 272000,
     "input_multiplier": 2,
     "output_multiplier": 1.5
    },
    {
     "rule": "fast_mode",
     "request_field": "service_tier: priority",
     "multiplier": 2
    }
   ]
  },
  {
   "id": "gpt-6.1-sol",
   "name": "GPT-6.1 Sol",
   "provider": "openai",
   "category": "chat",
   "recommended_endpoint": "/v1/responses",
   "endpoints": [
    "/v1/chat/completions",